{
	"run_id": "2026-10-15-train-001",
	"type": "training",
	"status": "succeeded",
	"started": "2026-10-15T08:00:00Z",
	"finished": "2026-10-15T09:12:40Z",
	"exit_code": 0,
	"lab": "../stock-count.recolab.json",
	"engine": {
		"version": "1.3.0",
		"model_sha256": "7c4a8d09ca3762af61e59520943dc26494f8941b4a1d0e1f6c1a2b3c4d5e6f70",
		"components": [
			{
				"name": "digits",
				"version": "1.3.0",
				"model_sha256": "7c4a8d09ca3762af61e59520943dc26494f8941b4a1d0e1f6c1a2b3c4d5e6f70"
			}
		]
	},
	"datasets": {
		"train": {
			"sample_count": 480
		},
		"validation": {
			"sample_count": 60
		}
	},
	"parameters": {
		"epochs": 20,
		"batch_size": 16,
		"learning_rate": 0.00005,
		"stopped_after_epoch": 6
	},
	"metrics": {
		"loss": 0.118,
		"field_accuracy": 0.962
	},
	"files": {
		"history": "2026-10-15-train-001.history.jsonl",
		"log": "2026-10-15-train-001.log",
		"artifacts": ["models/trocr-stock-count"]
	},
	"message": "Stopped after epoch 6: no better validation field_accuracy for 3 epochs"
}
